{
  "$schema": "./schema/hld.schema.json",
  "whiteboard_minutes": 45,
  "status_options": [
    { "id": "todo", "label": "Not started" },
    { "id": "practiced", "label": "Practiced" },
    { "id": "ready", "label": "Ready" }
  ],
  "framework": [
    { "id": "fw-requirements", "step": "Requirements", "minutes": 5, "prompts": ["Functional: the 3 to 5 things it must do. Write them down.", "Non-functional: scale, latency target, availability, consistency, multi-tenancy.", "Out of scope: say what you are not designing."] },
    { "id": "fw-estimates", "step": "Estimates", "minutes": 3, "prompts": ["Requests per second, average and peak.", "Storage per day and per year.", "Only the numbers that change a design decision."] },
    { "id": "fw-api", "step": "API", "minutes": 4, "prompts": ["3 to 5 endpoints or events with key fields.", "Idempotency keys on writes.", "Pagination on list calls; derive tenant identity from authenticated context and authorize every tenant-scoped operation."] },
    { "id": "fw-data", "step": "Data model", "minutes": 4, "prompts": ["Entities and the access pattern for each.", "Partition key and why.", "SQL or NoSQL, decided by the access pattern."] },
    { "id": "fw-diagram", "step": "High-level diagram", "minutes": 8, "prompts": ["Client to storage, left to right.", "Walk one request through it out loud.", "Name the GCP service under each box."] },
    { "id": "fw-deep", "step": "Two deep dives", "minutes": 12, "prompts": ["Pick the hardest part, or ask which they care about.", "Show options, pick one, say the trade-off.", "Numbers where they matter."] },
    { "id": "fw-reliability", "step": "Reliability and observability", "minutes": 6, "differentiator": true, "prompts": ["SLIs and SLOs for the user-facing path.", "Multi-window burn-rate alerts, not thresholds.", "Top 3 failure modes and what happens in each.", "This is your edge: say how you would get paged and how you would debug it."] },
    { "id": "fw-tradeoffs", "step": "Trade-offs and wrap", "minutes": 3, "prompts": ["What you chose and what it cost.", "What changes at 10x.", "What you would build next."] }
  ],
  "numbers": {
    "latency": [
      { "op": "Main memory reference", "value": "about 100 ns" },
      { "op": "Redis GET in the same zone", "value": "about 0.5 to 1 ms round trip" },
      { "op": "SSD random read", "value": "about 100 us" },
      { "op": "Round trip within a zone", "value": "about 0.5 ms" },
      { "op": "Round trip across regions in one continent", "value": "about 30 to 80 ms" },
      { "op": "Round trip across an ocean", "value": "about 100 to 150 ms" },
      { "op": "LLM first token, hosted model", "value": "hundreds of ms to a few seconds" }
    ],
    "capacity": [
      { "rule": "Seconds in a day", "value": "86,400, round to 100K" },
      { "rule": "1M requests per day", "value": "about 12 per second" },
      { "rule": "100M requests per day", "value": "about 1,200 per second" },
      { "rule": "Peak versus average", "value": "plan for 2 to 3x" },
      { "rule": "1 KB x 1M per day", "value": "1 GB per day, about 365 GB per year" },
      { "rule": "Prometheus-style sample", "value": "about 1 to 2 bytes compressed" },
      { "rule": "One Redis node", "value": "order of 100K simple ops per second" },
      { "rule": "One stateless app server", "value": "order of 1K to 10K requests per second" }
    ],
    "note": "Ballparks, not benchmarks. Say \"roughly\" and move on; the interviewer wants the order of magnitude and what it implies."
  },
  "blocks": [
    { "name": "Load balancer", "use": "Spread traffic, health checks, TLS termination.", "watch": "Sticky sessions hide state problems.", "gcp": "Cloud Load Balancing" },
    { "name": "API gateway", "use": "Auth, rate limits, routing, request IDs.", "watch": "Becomes a bottleneck if it does business logic.", "gcp": "Apigee or API Gateway" },
    { "name": "Cache", "use": "Read-heavy data, sessions, rate-limit counters.", "watch": "Invalidation, stampedes on expiry, hot keys.", "gcp": "Memorystore (Redis)" },
    { "name": "Queue or log", "use": "Decouple producers and consumers, absorb spikes, replay.", "watch": "At-least-once delivery means consumers must be idempotent.", "gcp": "Pub/Sub, Managed Service for Apache Kafka" },
    { "name": "Relational DB", "use": "Transactions, joins, strong consistency.", "watch": "Write scaling needs sharding; plan the partition key.", "gcp": "Cloud SQL, AlloyDB, Spanner for global scale" },
    { "name": "Wide-column or document store", "use": "High write throughput, key-based access, time series.", "watch": "Design rows around queries; hot row keys.", "gcp": "Bigtable, Firestore" },
    { "name": "Object storage", "use": "Blobs, logs, model artifacts, cold tiers.", "watch": "Latency is tens of ms; batch reads.", "gcp": "Cloud Storage (GCS)" },
    { "name": "Search", "use": "Full-text and filtered search.", "watch": "Index lag, mapping changes.", "gcp": "Vertex AI Search, Elasticsearch on GKE" },
    { "name": "Vector index", "use": "Semantic retrieval for RAG and similar-incident lookup.", "watch": "Pair with keyword search; evaluate recall separately.", "gcp": "Vertex AI Vector Search, AlloyDB pgvector" },
    { "name": "Stream processing", "use": "Windowed aggregates, enrichment, real-time pipelines.", "watch": "Late data, exactly-once claims.", "gcp": "Dataflow (Apache Beam)" },
    { "name": "Workflow engine", "use": "Multi-step jobs with retries and state.", "watch": "Keep steps idempotent.", "gcp": "Workflows, Cloud Tasks, Cloud Composer" }
  ],
  "reliability": {
    "terms": [
      { "term": "SLI", "meaning": "A measured ratio of good events to all events, e.g. requests under 300 ms and not 5xx." },
      { "term": "SLO", "meaning": "The target for the SLI over a window, e.g. 99.9% over 30 days." },
      { "term": "Error budget", "meaning": "1 minus the SLO. A time-based 99.9% SLO over 30 days permits about 43 minutes of outage; a request-based SLO permits 0.1% bad requests, which is not automatically a duration." },
      { "term": "Burn rate", "meaning": "How fast the budget is being spent. Burn rate 1 spends exactly the budget in the window." }
    ],
    "burn_rates": [
      { "severity": "Page", "budget": "2% in 1 hour", "burn_rate": "14.4", "windows": "1h long, 5m short" },
      { "severity": "Page", "budget": "5% in 6 hours", "burn_rate": "6", "windows": "6h long, 30m short" },
      { "severity": "Ticket", "budget": "10% in 3 days", "burn_rate": "1", "windows": "3d long, 6h short" }
    ],
    "burn_note": "From the Google SRE Workbook for a 30-day window. Both windows must exceed the burn rate: the long one proves it is significant, the short one proves it is still happening, so alerts reset quickly.",
    "patterns": [
      { "name": "Timeouts everywhere", "what": "Every network call gets a deadline shorter than its caller's." },
      { "name": "Retries with backoff and jitter", "what": "Cap attempts; only retry idempotent operations." },
      { "name": "Circuit breaker", "what": "Stop calling a failing dependency, fail fast, probe to recover." },
      { "name": "Bulkheads", "what": "Separate pools per dependency or tenant so one cannot starve the rest." },
      { "name": "Load shedding", "what": "Reject low-priority work early when saturated; protect the core path." },
      { "name": "Idempotency keys", "what": "Client-supplied key makes retries safe on writes." },
      { "name": "Outbox pattern", "what": "Write the event to the DB in the same transaction, publish from there." },
      { "name": "Graceful degradation", "what": "Serve stale cache or partial results instead of an error." },
      { "name": "Canary and auto-rollback", "what": "Ship to a slice, compare SLIs to baseline, roll back on burn." },
      { "name": "Dead man's switch", "what": "Alert when the monitoring pipeline itself goes quiet." }
    ]
  },
  "gcp_map": [
    { "generic": "Kubernetes", "gcp": "GKE", "note": "Autopilot for less node management." },
    { "generic": "Containers without clusters, Lambda, Fargate", "gcp": "Cloud Run, Cloud Run functions", "note": "Good default for stateless services and agents." },
    { "generic": "Prometheus", "gcp": "Managed Service for Prometheus, Cloud Monitoring", "note": "PromQL keeps working." },
    { "generic": "Grafana dashboards", "gcp": "Cloud Monitoring dashboards, or Grafana on GKE", "note": "" },
    { "generic": "Splunk, ELK", "gcp": "Cloud Logging, Log Analytics in BigQuery", "note": "" },
    { "generic": "Zipkin, Jaeger, OpenTelemetry traces", "gcp": "Cloud Trace", "note": "Accepts OTLP." },
    { "generic": "Kafka", "gcp": "Pub/Sub, or Managed Service for Apache Kafka", "note": "Pub/Sub ordering keys for per-entity order." },
    { "generic": "SQS", "gcp": "Pub/Sub, Cloud Tasks", "note": "Cloud Tasks for rate-controlled dispatch." },
    { "generic": "S3", "gcp": "Cloud Storage (GCS)", "note": "" },
    { "generic": "Postgres, MySQL", "gcp": "Cloud SQL, AlloyDB", "note": "AlloyDB for heavier Postgres and pgvector." },
    { "generic": "Global strongly consistent SQL", "gcp": "Spanner", "note": "" },
    { "generic": "DynamoDB, Cassandra, HBase", "gcp": "Bigtable, Firestore", "note": "" },
    { "generic": "Redis", "gcp": "Memorystore", "note": "" },
    { "generic": "Redshift, Snowflake", "gcp": "BigQuery", "note": "" },
    { "generic": "Spark", "gcp": "Dataproc", "note": "" },
    { "generic": "Flink, Beam", "gcp": "Dataflow", "note": "" },
    { "generic": "Airflow", "gcp": "Cloud Composer", "note": "" },
    { "generic": "Step Functions", "gcp": "Workflows", "note": "" },
    { "generic": "Cron", "gcp": "Cloud Scheduler", "note": "" },
    { "generic": "API gateway", "gcp": "Apigee, API Gateway", "note": "" },
    { "generic": "CDN", "gcp": "Cloud CDN", "note": "" },
    { "generic": "Secrets, KMS", "gcp": "Secret Manager, Cloud KMS", "note": "" },
    { "generic": "IAM roles for pods", "gcp": "Workload Identity", "note": "" },